{
  "release_id": "awesome",
  "library_id": "EPMatt",
  "blueprint_id": "shelly_button_1",
  "title": "Controller - Shelly Button 1",
  "maintainers": [
    {
      "id": "EPMatt",
      "name": "EPMatt"
    }
  ],
  "description": "Controller automation for executing any kind of action triggered by the provided Shelly Button 1.",
  "versions": ["2025.04.12"],
  "latest_version": "2025.04.12",
  "supported_integrations": ["Shelly"],
  "status": "active"
}
