{
  "release_id": "awesome",
  "library_id": "EPMatt",
  "blueprint_id": "ikea_e2123",
  "title": "Controller - IKEA E2123 SYMFONISK sound remote, gen 2",
  "maintainers": [
    {
      "id": "EPMatt",
      "name": "EPMatt"
    }
  ],
  "description": "Controller automation for executing any kind of action triggered by the provided IKEA E2123 SYMFONISK sound remote, gen 2. Supports Zigbee2MQTT, ZHA, deCONZ.",
  "versions": ["2025.03.28"],
  "latest_version": "2025.03.28",
  "supported_integrations": ["ZHA", "Zigbee2MQTT", "deCONZ"],
  "status": "active"
}
