{
  "release_id": "awesome",
  "library_id": "EPMatt",
  "blueprint_id": "media_player",
  "title": "Hook - Media Player",
  "maintainers": [
    {
      "id": "EPMatt",
      "name": "EPMatt"
    }
  ],
  "description": "This Hook blueprint allows building a controller-based automation to control a media player. Supports volume setting, play/pause and track selection.",
  "versions": ["2025.12.22"],
  "latest_version": "2025.12.22",
  "supported_integrations": [],
  "status": "active"
}
