{
  "release_id": "awesome",
  "library_id": "EPMatt",
  "blueprint_id": "persistent_notification_to_mobile",
  "title": "Send Web UI persistent notifications to Mobile Devices",
  "maintainers": [
    {
      "id": "EPMatt",
      "name": "EPMatt"
    }
  ],
  "description": "Send Web UI persistent notifications with the provided ID to the specified Mobile Devices.",
  "versions": ["2021.10.26"],
  "latest_version": "2021.10.26",
  "supported_integrations": [],
  "status": "active"
}
