{
  "release_id": "awesome",
  "library_id": "EPMatt",
  "blueprint_id": "shelly_snsn_0024x",
  "title": "Controller - Shelly SNSN-0024x Plus i4 with Wall switch 4",
  "maintainers": [
    {
      "id": "EPMatt",
      "name": "EPMatt"
    }
  ],
  "description": "Controller automation for executing any kind of action triggered by the provided Shelly SNSN-0024x Plus i4 with Wall switch 4.",
  "versions": ["2025.03.25"],
  "latest_version": "2025.03.25",
  "supported_integrations": ["Shelly"],
  "status": "active"
}
