{
  "release_id": "awesome",
  "library_id": "EPMatt",
  "blueprint_id": "ikea_e1766",
  "title": "Controller - IKEA E1766 TRÅDFRI Open/Close Remote",
  "maintainers": [
    {
      "id": "EPMatt",
      "name": "EPMatt"
    }
  ],
  "description": "Controller automation for executing any kind of action triggered by the provided IKEA E1766 TRÅDFRI Open/Close Remote.",
  "versions": ["2025.04.19"],
  "latest_version": "2025.04.19",
  "supported_integrations": ["ZHA", "Zigbee2MQTT", "deCONZ"],
  "status": "active"
}
