{
  "release_id": "awesome",
  "library_id": "EPMatt",
  "blueprint_id": "ikea_ictc_g_1",
  "title": "Controller - IKEA ICTC-G-1 TRÅDFRI wireless dimmer",
  "maintainers": [
    {
      "id": "EPMatt",
      "name": "EPMatt"
    }
  ],
  "description": "Controller automation for executing any kind of action triggered by the provided IKEA ICTC-G-1 TRÅDFRI wireless dimmer.",
  "versions": ["2025.04.19"],
  "latest_version": "2025.04.19",
  "supported_integrations": ["ZHA", "Zigbee2MQTT", "deCONZ"],
  "status": "active"
}
