{
  "release_id": "awesome",
  "library_id": "EPMatt",
  "blueprint_id": "sonoff_snzb01",
  "title": "Controller - SONOFF SNZB-01 Wireless Switch",
  "maintainers": [
    {
      "id": "EPMatt",
      "name": "EPMatt"
    }
  ],
  "description": "Controller automation for executing any kind of action triggered by the provided SONOFF SNZB-01 Wireless Switch.",
  "versions": ["2025.04.19"],
  "latest_version": "2025.04.19",
  "supported_integrations": ["ZHA", "Zigbee2MQTT", "deCONZ"],
  "status": "active"
}
