{
  "release_id": "awesome",
  "library_id": "EPMatt",
  "blueprint_id": "ikea_e1743",
  "title": "Controller - IKEA E1743 TRÅDFRI On/Off Switch & Dimmer",
  "maintainers": [
    {
      "id": "EPMatt",
      "name": "EPMatt"
    }
  ],
  "description": "Controller automation for executing any kind of action triggered by the provided IKEA E1743 TRÅDFRI On/Off Switch & Dimmer.",
  "versions": ["2025.10.12"],
  "latest_version": "2025.10.12",
  "supported_integrations": ["ZHA", "Zigbee2MQTT", "deCONZ"],
  "status": "active"
}
