{
  "release_id": "awesome",
  "library_id": "EPMatt",
  "blueprint_id": "tuya_ZG-101Z-D",
  "title": "Controller - Tuya ZG-101Z/D Smart knob",
  "maintainers": [
    {
      "id": "EPMatt",
      "name": "EPMatt"
    }
  ],
  "description": "Controller automation for executing any kind of action triggered by the provided Tuya ZG-101Z/D Smart knob.",
  "versions": ["2025.10.14"],
  "latest_version": "2025.10.14",
  "supported_integrations": ["ZHA", "Zigbee2MQTT"],
  "status": "active"
}
