{
  "release_id": "awesome",
  "library_id": "EPMatt",
  "blueprint_id": "light",
  "title": "Hook - Light",
  "maintainers": [
    {
      "id": "EPMatt",
      "name": "EPMatt"
    }
  ],
  "description": "This Hook blueprint allows building a controller-based automation to control a light. Supports brightness and color control for both white temperature and RGB lights.",
  "versions": ["2025.12.22"],
  "latest_version": "2025.12.22",
  "supported_integrations": [],
  "status": "active"
}
